Sheet: 2014 Medal Standings
B4: Nation | C4: Gold | D4: Silver | E4: Bronze | F4: Total | G4: 1924-2014 | H4: # Athletes | I4: Per Participant
B5: Russia (RUS) | C5: 13 | D5: 11 | E5: 9 | F5: =SUM(RC[-3]:RC[-1]) -> 33 | H5: 232 | I5: =#REF!/#REF! -> 0.14224137931034483
B6: United States (USA) | C6: 9 | D6: 7 | E6: 12 | F6: =SUM(RC[-3]:RC[-1]) -> 28 | H6: 230 | I6: =#REF!/#REF! -> 0.12173913043478261
B7: Norway (NOR) | C7: 11 | D7: 5 | E7: 10 | F7: =SUM(RC[-3]:RC[-1]) -> 26 | H7: 134 | I7: =#REF!/#REF! -> 0.19402985074626866
B8: Canada (CAN) | C8: 10 | D8: 10 | E8: 5 | F8: =SUM(RC[-3]:RC[-1]) -> 25 | H8: 222 | I8: =#REF!/#REF! -> 0.11261261261261261
B9: Netherlands (NED) | C9: 8 | D9: 7 | E9: 9 | F9: =SUM(RC[-3]:RC[-1]) -> 24 | H9: 41 | I9: =#REF!/#REF! -> 0.58536585365853655
B10: Germany (GER) | C10: 8 | D10: 6 | E10: 5 | F10: =SUM(RC[-3]:RC[-1]) -> 19 | H10: 153 | I10: =#REF!/#REF! -> 0.12418300653594772
B11: Austria (AUT) | C11: 4 | D11: 8 | E11: 5 | F11: =SUM(RC[-3]:RC[-1]) -> 17 | H11: 132 | I11: =#REF!/#REF! -> 0.12878787878787878
B12: France (FRA) | C12: 4 | D12: 4 | E12: 7 | F12: =SUM(RC[-3]:RC[-1]) -> 15 | H12: 116 | I12: =#REF!/#REF! -> 0.12931034482758622
B13: Sweden (SWE) | C13: 2 | D13: 7 | E13: 6 | F13: =SUM(RC[-3]:RC[-1]) -> 15 | H13: 106 | I13: =#REF!/#REF! -> 0.14150943396226415
B14: Switzerland (CHE) | C14: 6 | D14: 3 | E14: 2 | F14: =SUM(RC[-3]:RC[-1]) -> 11 | H14: 163 | I14: =#REF!/#REF! -> 6.7484662576687116E-2
B15: China (CHN) | C15: 3 | D15: 4 | E15: 2 | F15: =SUM(RC[-3]:RC[-1]) -> 9 | H15: 66 | I15: =#REF!/#REF! -> 0.13636363636363635
B16: Czech Republic (CZE) | C16: 2 | D16: 4 | E16: 2 | F16: =SUM(RC[-3]:RC[-1]) -> 8 | H16: 88 | I16: =#REF!/#REF! -> 9.0909090909090912E-2
B17: Slovenia (SLO) | C17: 2 | D17: 2 | E17: 4 | F17: =SUM(RC[-3]:RC[-1]) -> 8 | H17: 66 | I17: =#REF!/#REF! -> 0.12121212121212122
B18: Italy (ITA) | C18: 0 | D18: 2 | E18: 6 | F18: =SUM(RC[-3]:RC[-1]) -> 8 | H18: 113 | I18: =#REF!/#REF! -> 7.0796460176991149E-2
B19: South Korea (KOR) | C19: 3 | D19: 3 | E19: 2 | F19: =SUM(RC[-3]:RC[-1]) -> 8 | H19: 71 | I19: =#REF!/#REF! -> 0.11267605633802817
B20: Japan (JPN) | C20: 1 | D20: 4 | E20: 3 | F20: =SUM(RC[-3]:RC[-1]) -> 8 | H20: 136 | I20: =#REF!/#REF! -> 5.8823529411764705E-2
B21: Belarus (BLR) | C21: 5 | D21: 0 | E21: 1 | F21: =SUM(RC[-3]:RC[-1]) -> 6 | H21: 26 | I21: =#REF!/#REF! -> 0.23076923076923078
B22: Poland (POL) | C22: 4 | D22: 1 | E22: 1 | F22: =SUM(RC[-3]:RC[-1]) -> 6 | H22: 59 | I22: =#REF!/#REF! -> 0.10169491525423729
B23: Finland (FIN) | C23: 1 | D23: 3 | E23: 1 | F23: =SUM(RC[-3]:RC[-1]) -> 5 | H23: 103 | I23: =#REF!/#REF! -> 4.8543689320388349E-2
B24: Great Britain (GBR) | C24: 1 | D24: 1 | E24: 2 | F24: =SUM(RC[-3]:RC[-1]) -> 4 | H24: 56 | I24: =#REF!/#REF! -> 7.1428571428571425E-2
B25: Latvia LVA) | C25: 0 | D25: 2 | E25: 2 | F25: =SUM(RC[-3]:RC[-1]) -> 4 | H25: 58 | I25: =#REF!/#REF! -> 6.8965517241379309E-2
B26: Australia (AUS) | C26: 0 | D26: 2 | E26: 1 | F26: =SUM(RC[-3]:RC[-1]) -> 3 | H26: 60 | I26: =#REF!/#REF! -> 0.05
B27: Ukraine (UKR) | C27: 1 | D27: 0 | E27: 1 | F27: =SUM(RC[-3]:RC[-1]) -> 2 | H27: 45 | I27: =#REF!/#REF! -> 4.4444444444444446E-2
B28: Croatia (HRV) | C28: 0 | D28: 1 | E28: 0 | F28: =SUM(RC[-3]:RC[-1]) -> 1 | H28: 11 | I28: =#REF!/#REF! -> 9.0909090909090912E-2
B29: Kazakhstan (KAZ) | C29: 0 | D29: 0 | E29: 1 | F29: =SUM(RC[-3]:RC[-1]) -> 1 | H29: 52 | I29: =#REF!/#REF! -> 1.9230769230769232E-2
B30: Slovakia (SVK) | C30: 1 | D30: 0 | E30: 0 | F30: =SUM(RC[-3]:RC[-1]) -> 1 | H30: 63 | I30: =#REF!/#REF! -> 1.5873015873015872E-2
B32: Use the dropdown arrows next to each of the column headings to sort or filter the medal standings.

Sheet: Data
A1: Winter Olympics Medal Results by Year | H1: Medal Winners Over Time
A2: Year | B2: Nation | C2: Gold Medals | D2: Silver Medals | E2: Bronze Medals | F2: Total Medals | H2: Nation | I2: 1924 | J2: 1928 | K2: 1932 | L2: 1936 | M2: 1948 | N2: 1952 | O2: 1956 | P2: 1960 | Q2: 1964 | R2: 1968 | S2: 1972 | T2: 1976 | U2: 1980 | V2: 1984 | W2: 1988 | X2: 1992 | Y2: 1994 | Z2: 1998 | AA2: 2002 | AB2: 2006 | AC2: 2010 | AD2: 2014
A3: 1924 | B3: Austria (AUT) | C3: 2 | D3: 1 | E3: 0 | F3: =SUM(#REF!) -> 3 | H3: Russia (RUS) | I3: 0 | J3: 0 | K3: 0 | L3: 0 | M3: 0 | N3: 0 | O3: 16 | P3: 21 | Q3: 25 | R3: 13 | S3: 16 | T3: 27 | U3: 22 | V3: 25 | W3: 29 | X3: 23 | Y3: 23 | Z3: 18 | AA3: 13 | AB3: 22 | AC3: 15 | AD3: 33
A4: 1924 | B4: Belgium (BEL) | C4: 0 | D4: 0 | E4: 1 | F4: =SUM(#REF!) -> 1 | H4: United States (USA) | I4: 4 | J4: 6 | K4: 12 | L4: 4 | M4: 9 | N4: 11 | O4: 7 | P4: 10 | Q4: 6 | R4: 7 | S4: 8 | T4: 10 | U4: 12 | V4: 8 | W4: 6 | X4: 11 | Y4: 13 | Z4: 13 | AA4: 34 | AB4: 25 | AC4: 37 | AD4: 28
A5: 1924 | B5: Canada (CAN) | C5: 1 | D5: 0 | E5: 0 | F5: =SUM(#REF!) -> 1 | H5: Norway (NOR) | I5: 17 | J5: 15 | K5: 10 | L5: 15 | M5: 10 | N5: 16 | O5: 4 | P5: 6 | Q5: 15 | R5: 14 | S5: 12 | T5: 7 | U5: 10 | V5: 9 | W5: 5 | X5: 20 | Y5: 26 | Z5: 25 | AA5: 25 | AB5: 19 | AC5: 23 | AD5: 26
A6: 1924 | B6: Finland (FIN) | C6: 4 | D6: 3 | E6: 3 | F6: =SUM(#REF!) -> 10 | H6: Canada (CAN) | I6: 1 | J6: 1 | K6: 7 | L6: 1 | M6: 3 | N6: 2 | O6: 3 | P6: 4 | Q6: 3 | R6: 3 | S6: 1 | T6: 3 | U6: 2 | V6: 4 | W6: 5 | X6: 7 | Y6: 13 | Z6: 15 | AA6: 17 | AB6: 24 | AC6: 26 | AD6: 25
A7: 1924 | B7: France (FRA) | C7: 0 | D7: 0 | E7: 2 | F7: =SUM(#REF!) -> 2 | H7: Netherlands (NED) | I7: 0 | J7: 0 | K7: 0 | L7: 0 | M7: 0 | N7: 3 | O7: 0 | P7: 2 | Q7: 2 | R7: 9 | S7: 9 | T7: 6 | U7: 4 | V7: 0 | W7: 7 | X7: 4 | Y7: 4 | Z7: 11 | AA7: 8 | AB7: 9 | AC7: 8 | AD7: 24
A8: 1924 | B8: Great Britain (GBR) | C8: 1 | D8: 1 | E8: 2 | F8: =SUM(#REF!) -> 4 | H8: Germany (GER) | I8: 0 | J8: 1 | K8: 2 | L8: 6 | M8: 0 | N8: 7 | O8: 1 | P8: 8 | Q8: 9 | R8: 12 | S8: 19 | T8: 29 | U8: 28 | V8: 28 | W8: 33 | X8: 26 | Y8: 24 | Z8: 29 | AA8: 36 | AB8: 29 | AC8: 30 | AD8: 19
A9: 1924 | B9: Norway (NOR) | C9: 4 | D9: 7 | E9: 6 | F9: =SUM(#REF!) -> 17 | H9: Austria (AUT) | I9: =R[-8]C[-3] -> 0 | J9: 4 | K9: =R[-6]C[-5] -> 3 | L9: 4 | M9: 8 | N9: 8 | O9: 11 | P9: 6 | Q9: 12 | R9: 11 | S9: 5 | T9: 6 | U9: 7 | V9: 1 | W9: 10 | X9: 21 | Y9: 9 | Z9: 17 | AA9: 17 | AB9: 23 | AC9: 16 | AD9: 17
A10: 1924 | B10: Sweden (SWE) | C10: 1 | D10: 1 | E10: 0 | F10: =SUM(#REF!) -> 2 | H10: France (FRA) | I10: 0 | J10: 0 | K10: 0 | L10: 0 | M10: 0 | N10: 1 | O10: 0 | P10: 3 | Q10: 7 | R10: 9 | S10: 3 | T10: 1 | U10: 1 | V10: 3 | W10: 2 | X10: 9 | Y10: 5 | Z10: 8 | AA10: 11 | AB10: 9 | AC10: 11 | AD10: 15
A11: 1924 | B11: Switzerland (SUI) | C11: 1 | D11: 0 | E11: 1 | F11: =SUM(#REF!) -> 2 | H11: Sweden (SWE) | I11: 2 | J11: 5 | K11: 3 | L11: 7 | M11: 10 | N11: 4 | O11: 10 | P11: 7 | Q11: 7 | R11: 8 | S11: 4 | T11: 2 | U11: 4 | V11: 8 | W11: 6 | X11: 4 | Y11: 3 | Z11: 3 | AA11: 7 | AB11: 14 | AC11: 11 | AD11: 15
A12: 1924 | B12: United States (USA) | C12: 1 | D12: 2 | E12: 1 | F12: =SUM(#REF!) -> 4 | H12: Switzerland (CHE) | I12: 2 | J12: 1 | K12: 1 | L12: 6 | M12: 10 | N12: 2 | O12: 6 | P12: 2 | Q12: 0 | R12: 6 | S12: 10 | T12: 5 | U12: 5 | V12: 5 | W12: 15 | X12: 3 | Y12: 9 | Z12: 7 | AA12: 11 | AB12: 14 | AC12: 9 | AD12: 11
A13: 1928 | B13: Austria (AUT) | C13: 0 | D13: 3 | E13: 1 | F13: =SUM(#REF!) -> 4 | H13: China (CHN) | I13: 0 | J13: 0 | K13: 0 | L13: 0 | M13: 0 | N13: 0 | O13: 0 | P13: 0 | Q13: 0 | R13: 0 | S13: 0 | T13: 0 | U13: 0 | V13: 0 | W13: 0 | X13: 3 | Y13: 3 | Z13: 8 | AA13: 8 | AB13: 11 | AC13: 11 | AD13: 9
A14: 1928 | B14: Belgium (BEL) | C14: 0 | D14: 0 | E14: 1 | F14: =SUM(#REF!) -> 1 | H14: Czech Republic (CZE) | I14: 0 | J14: 0 | K14: 0 | L14: 0 | M14: 0 | N14: 0 | O14: 0 | P14: 0 | Q14: 0 | R14: 0 | S14: 0 | T14: 0 | U14: 0 | V14: 0 | W14: 0 | X14: 3 | Y14: 0 | Z14: 0 | AA14: 3 | AB14: 4 | AC14: 6 | AD14: 8
A15: 1928 | B15: Canada (CAN) | C15: 1 | D15: 0 | E15: 0 | F15: =SUM(#REF!) -> 1 | H15: Slovenia (SLO) | I15: 0 | J15: 0 | K15: 0 | L15: 0 | M15: 0 | N15: 0 | O15: 0 | P15: 0 | Q15: 0 | R15: 0 | S15: 0 | T15: 0 | U15: 0 | V15: 0 | W15: 0 | X15: 0 | Y15: 3 | Z15: 0 | AA15: 1 | AC15: 3 | AD15: 8
A16: 1928 | B16: Czechoslovakia | C16: 0 | D16: 0 | E16: 1 | F16: =SUM(#REF!) -> 1 | H16: Italy (ITA) | I16: 0 | J16: 0 | K16: 0 | L16: 0 | M16: 1 | N16: 2 | O16: 3 | P16: 1 | Q16: 4 | R16: 4 | S16: 5 | T16: 4 | U16: 2 | V16: 2 | W16: 5 | X16: 14 | Y16: 20 | Z16: 10 | AA16: 13 | AB16: 11 | AC16: 5 | AD16: 8
A17: 1928 | B17: Finland (FIN) | C17: 2 | D17: 1 | E17: 1 | F17: =SUM(#REF!) -> 4 | H17: Korea (KOR) | I17: 0 | J17: 0 | K17: 0 | L17: 0 | M17: 0 | N17: 0 | O17: 0 | P17: 0 | Q17: 1 | R17: 0 | S17: 0 | T17: 0 | U17: 0 | V17: 0 | W17: 0 | X17: 5 | Y17: 6 | Z17: 6 | AA17: 4 | AB17: 11 | AC17: 14 | AD17: 8
A18: 1928 | B18: France (FRA) | C18: 1 | D18: 0 | E18: 0 | F18: =SUM(#REF!) -> 1 | H18: Japan (JPN) | I18: 0 | J18: 0 | K18: 0 | L18: 0 | M18: 0 | N18: 0 | O18: 1 | P18: 0 | Q18: 0 | R18: 0 | S18: 3 | T18: 0 | U18: 1 | V18: 1 | W18: 1 | X18: 7 | Y18: 5 | Z18: 10 | AA18: 2 | AB18: 1 | AC18: 5 | AD18: 8
A19: 1928 | B19: Germany (GER) | C19: 0 | D19: 0 | E19: 1 | F19: =SUM(#REF!) -> 1 | H19: Belarus (BLR) | I19: 0 | J19: 0 | K19: 0 | L19: 0 | M19: 0 | N19: 0 | O19: 0 | P19: 0 | Q19: 0 | R19: 0 | S19: 0 | T19: 0 | U19: 0 | V19: 0 | W19: 0 | X19: 0 | Y19: 2 | Z19: 2 | AA19: 1 | AB19: 1 | AC19: 3 | AD19: 6
A20: 1928 | B20: Great Britain (GBR) | C20: 0 | D20: 0 | E20: 1 | F20: =SUM(#REF!) -> 1 | H20: Poland (POL) | I20: 0 | J20: 0 | K20: 0 | L20: 0 | M20: 0 | N20: 0 | O20: 1 | P20: 2 | Q20: 0 | R20: 0 | S20: 1 | T20: 0 | U20: 0 | V20: 0 | W20: 0 | X20: 0 | Y20: 0 | Z20: 0 | AA20: 2 | AB20: 2 | AC20: 6 | AD20: 6
A21: 1928 | B21: Norway (NOR) | C21: 6 | D21: 4 | E21: 5 | F21: =SUM(#REF!) -> 15 | H21: Finland (FIN) | I21: 10 | J21: 4 | K21: 3 | L21: 6 | M21: 6 | N21: 9 | O21: 7 | P21: 8 | Q21: 10 | R21: 5 | S21: 5 | T21: 7 | U21: 9 | V21: 13 | W21: 7 | X21: 7 | Y21: 6 | Z21: 12 | AA21: 7 | AB21: 9 | AC21: 5 | AD21: 5
A22: 1928 | B22: Sweden (SWE) | C22: 2 | D22: 2 | E22: 1 | F22: =SUM(#REF!) -> 5 | H22: Great Britain (GBR) | I22: 4 | J22: 1 | K22: 0 | L22: 3 | M22: 2 | N22: 1 | O22: 0 | P22: 0 | Q22: 1 | R22: 0 | S22: 0 | T22: 1 | U22: 1 | V22: 1 | W22: 0 | X22: 0 | Y22: 2 | Z22: 1 | AA22: 2 | AB22: 1 | AC22: 1 | AD22: 4
A23: 1928 | B23: Switzerland (SUI) | C23: 0 | D23: 0 | E23: 1 | F23: =SUM(#REF!) -> 1 | H23: Latvia LVA) | I23: 0 | J23: 0 | K23: 0 | L23: 0 | M23: 0 | N23: 0 | O23: 0 | P23: 0 | Q23: 0 | R23: 0 | S23: 0 | T23: 0 | U23: 0 | V23: 0 | W23: 0 | X23: 0 | Y23: 0 | Z23: 0 | AA23: 0 | AB23: 1 | AC23: 2 | AD23: 4
A24: 1928 | B24: United States (USA) | C24: 2 | D24: 2 | E24: 2 | F24: =SUM(#REF!) -> 6 | H24: Australia (AUS) | I24: 0 | J24: 0 | K24: 0 | L24: 0 | M24: 0 | N24: 0 | O24: 0 | P24: 0 | Q24: 0 | R24: 0 | S24: 0 | T24: 0 | U24: 0 | V24: 0 | W24: 0 | X24: 0 | Y24: 0 | Z24: 1 | AA24: 2 | AB24: 2 | AC24: 3 | AD24: 3
A25: 1932 | B25: Austria (AUT) | C25: 1 | D25: 1 | E25: 0 | F25: =SUM(#REF!) -> 2 | H25: Ukraine (UKR) | I25: 0 | J25: 0 | K25: 0 | L25: 0 | M25: 0 | N25: 0 | O25: 0 | P25: 0 | Q25: 0 | R25: 0 | S25: 0 | T25: 0 | U25: 0 | V25: 0 | W25: 0 | X25: 0 | Y25: 2 | Z25: 1 | AA25: 0 | AB25: 2 | AC25: 0 | AD25: 2
A26: 1932 | B26: Canada (CAN) | C26: 1 | D26: 1 | E26: 5 | F26: =SUM(#REF!) -> 7 | H26: Croatia (HRV) | I26: 0 | J26: 0 | K26: 0 | L26: 0 | M26: 0 | N26: 0 | O26: 0 | P26: 0 | Q26: 0 | R26: 0 | S26: 0 | T26: 0 | U26: 0 | V26: 0 | W26: 0 | X26: 0 | Y26: 0 | Z26: 0 | AA26: 4 | AB26: 3 | AC26: 3 | AD26: 1
A27: 1932 | B27: Finland (FIN) | C27: 1 | D27: 1 | E27: 1 | F27: =SUM(#REF!) -> 3 | H27: Kazakhstan (KAZ) | I27: 0 | J27: 0 | K27: 0 | L27: 0 | M27: 0 | N27: 0 | O27: 0 | P27: 0 | Q27: 0 | R27: 0 | S27: 0 | T27: 0 | U27: 0 | V27: 0 | W27: 0 | X27: 0 | Y27: 3 | Z27: 2 | AA27: 0 | AB27: 0 | AC27: 1 | AD27: 1
A28: 1932 | B28: France (FRA) | C28: 1 | D28: 0 | E28: 0 | F28: =SUM(#REF!) -> 1 | H28: Slovakia (SVK) | I28: 0 | J28: 0 | K28: 0 | L28: 0 | M28: 0 | N28: 0 | O28: 0 | P28: 0 | Q28: 0 | R28: 0 | S28: 0 | T28: 0 | U28: 0 | V28: 0 | W28: 0 | X28: 0 | Y28: 0 | Z28: 0 | AA28: 0 | AB28: 1 | AC28: 3 | AD28: 1
A29: 1932 | B29: Germany (GER) | C29: 0 | D29: 0 | E29: 2 | F29: =SUM(#REF!) -> 2
A30: 1932 | B30: Hungary (HUN) | C30: 0 | D30: 0 | E30: 1 | F30: =SUM(#REF!) -> 1
A31: 1932 | B31: Norway (NOR) | C31: 3 | D31: 4 | E31: 3 | F31: =SUM(#REF!) -> 10
A32: 1932 | B32: Sweden (SWE) | C32: 1 | D32: 2 | E32: 0 | F32: =SUM(#REF!) -> 3
A33: 1932 | B33: Switzerland (SUI) | C33: 0 | D33: 1 | E33: 0 | F33: =SUM(#REF!) -> 1
A34: 1932 | B34: United States (USA) | C34: 6 | D34: 4 | E34: 2 | F34: =SUM(#REF!) -> 12
A35: 1936 | B35: Austria (AUT) | C35: 1 | D35: 1 | E35: 2 | F35: =SUM(#REF!) -> 4
A36: 1936 | B36: Canada (CAN) | C36: 0 | D36: 1 | E36: 0 | F36: =SUM(#REF!) -> 1
A37: 1936 | B37: Finland (FIN) | C37: 1 | D37: 2 | E37: 3 | F37: =SUM(#REF!) -> 6
A38: 1936 | B38: France (FRA) | C38: 0 | D38: 0 | E38: 1 | F38: =SUM(#REF!) -> 1
A39: 1936 | B39: Germany (GER) | C39: 3 | D39: 3 | E39: 0 | F39: =SUM(#REF!) -> 6
A40: 1936 | B40: Great Britain (GBR) | C40: 1 | D40: 1 | E40: 1 | F40: =SUM(#REF!) -> 3
A41: 1936 | B41: Hungary (HUN) | C41: 0 | D41: 0 | E41: 1 | F41: =SUM(#REF!) -> 1
A42: 1936 | B42: Norway (NOR) | C42: 7 | D42: 5 | E42: 3 | F42: =SUM(#REF!) -> 15
A43: 1936 | B43: Sweden (SWE) | C43: 2 | D43: 2 | E43: 3 | F43: =SUM(#REF!) -> 7
A44: 1936 | B44: Switzerland (SUI) | C44: 1 | D44: 2 | E44: 0 | F44: =SUM(#REF!) -> 3
A45: 1936 | B45: United States (USA) | C45: 1 | D45: 0 | E45: 3 | F45: =SUM(#REF!) -> 4
A46: 1948 | B46: Austria (AUT) | C46: 1 | D46: 3 | E46: 4 | F46: =SUM(#REF!) -> 8
A47: 1948 | B47: Belgium (BEL) | C47: 1 | D47: 1 | E47: 0 | F47: =SUM(#REF!) -> 2
A48: 1948 | B48: Canada (CAN) | C48: 2 | D48: 0 | E48: 1 | F48: =SUM(#REF!) -> 3
A49: 1948 | B49: Czechoslovakia | C49: 0 | D49: 1 | E49: 0 | F49: =SUM(#REF!) -> 1
A50: 1948 | B50: Finland (FIN) | C50: 1 | D50: 3 | E50: 2 | F50: =SUM(#REF!) -> 6
A51: 1948 | B51: France (FRA) | C51: 2 | D51: 1 | E51: 2 | F51: =SUM(#REF!) -> 5
A52: 1948 | B52: Great Britain (GBR) | C52: 0 | D52: 0 | E52: 2 | F52: =SUM(#REF!) -> 2
A53: 1948 | B53: Hungary (HUN) | C53: 0 | D53: 1 | E53: 0 | F53: =SUM(#REF!) -> 1
A54: 1948 | B54: Italy (ITA) | C54: 1 | D54: 0 | E54: 0 | F54: =SUM(#REF!) -> 1
A55: 1948 | B55: Norway (NOR) | C55: 4 | D55: 3 | E55: 3 | F55: =SUM(#REF!) -> 10
A56: 1948 | B56: Sweden (SWE) | C56: 4 | D56: 3 | E56: 3 | F56: =SUM(#REF!) -> 10
A57: 1948 | B57: Switzerland (SUI) | C57: 3 | D57: 4 | E57: 3 | F57: =SUM(#REF!) -> 10
A58: 1948 | B58: United States (USA) | C58: 3 | D58: 4 | E58: 2 | F58: =SUM(#REF!) -> 9
A59: 1952 | B59: Austria (AUT) | C59: 2 | D59: 4 | E59: 2 | F59: =SUM(#REF!) -> 8
A60: 1952 | B60: Canada (CAN) | C60: 1 | D60: 0 | E60: 1 | F60: =SUM(#REF!) -> 2
A61: 1952 | B61: Finland (FIN) | C61: 3 | D61: 4 | E61: 2 | F61: =SUM(#REF!) -> 9
A62: 1952 | B62: France (FRA) | C62: 0 | D62: 0 | E62: 1 | F62: =SUM(#REF!) -> 1
A63: 1952 | B63: Germany (GER) | C63: 3 | D63: 2 | E63: 2 | F63: =SUM(#REF!) -> 7
A64: 1952 | B64: Great Britain (GBR) | C64: 1 | D64: 0 | E64: 0 | F64: =SUM(#REF!) -> 1
A65: 1952 | B65: Hungary (HUN) | C65: 0 | D65: 0 | E65: 1 | F65: =SUM(#REF!) -> 1
A66: 1952 | B66: Italy (ITA) | C66: 1 | D66: 0 | E66: 1 | F66: =SUM(#REF!) -> 2
A67: 1952 | B67: Netherlands (NED) | C67: 0 | D67: 3 | E67: 0 | F67: =SUM(#REF!) -> 3
A68: 1952 | B68: Norway (NOR) | C68: 7 | D68: 3 | E68: 6 | F68: =SUM(#REF!) -> 16
A69: 1952 | B69: Sweden (SWE) | C69: 0 | D69: 0 | E69: 4 | F69: =SUM(#REF!) -> 4
A70: 1952 | B70: Switzerland (SUI) | C70: 0 | D70: 0 | E70: 2 | F70: =SUM(#REF!) -> 2
A71: 1952 | B71: United States (USA) | C71: 4 | D71: 6 | E71: 1 | F71: =SUM(#REF!) -> 11
A72: 1956 | B72: Austria (AUT) | C72: 4 | D72: 3 | E72: 4 | F72: =SUM(#REF!) -> 11
A73: 1956 | B73: Canada (CAN) | C73: 0 | D73: 1 | E73: 2 | F73: =SUM(#REF!) -> 3
A74: 1956 | B74: Finland (FIN) | C74: 3 | D74: 3 | E74: 1 | F74: =SUM(#REF!) -> 7
A75: 1956 | B75: Germany (GER) | C75: 1 | D75: 0 | E75: 0 | F75: =SUM(#REF!) -> 1
A76: 1956 | B76: Hungary (HUN) | C76: 0 | D76: 0 | E76: 1 | F76: =SUM(#REF!) -> 1
A77: 1956 | B77: Italy (ITA) | C77: 1 | D77: 2 | E77: 0 | F77: =SUM(#REF!) -> 3
A78: 1956 | B78: Japan (JPN) | C78: 0 | D78: 1 | E78: 0 | F78: =SUM(#REF!) -> 1
A79: 1956 | B79: Norway (NOR) | C79: 2 | D79: 1 | E79: 1 | F79: =SUM(#REF!) -> 4
A80: 1956 | B80: Poland (POL) | C80: 0 | D80: 0 | E80: 1 | F80: =SUM(#REF!) -> 1
A81: 1956 | B81: Russia (RUS) | C81: 7 | D81: 3 | E81: 6 | F81: =SUM(#REF!) -> 16
A82: 1956 | B82: Sweden (SWE) | C82: 2 | D82: 4 | E82: 4 | F82: =SUM(#REF!) -> 10
A83: 1956 | B83: Switzerland (SUI) | C83: 3 | D83: 2 | E83: 1 | F83: =SUM(#REF!) -> 6
A84: 1956 | B84: United States (USA) | C84: 2 | D84: 3 | E84: 2 | F84: =SUM(#REF!) -> 7
A85: 1960 | B85: Austria (AUT) | C85: 1 | D85: 2 | E85: 3 | F85: =SUM(#REF!) -> 6
A86: 1960 | B86: Canada (CAN) | C86: 2 | D86: 1 | E86: 1 | F86: =SUM(#REF!) -> 4
A87: 1960 | B87: Czechoslovakia | C87: 0 | D87: 1 | E87: 0 | F87: =SUM(#REF!) -> 1
A88: 1960 | B88: Finland (FIN) | C88: 2 | D88: 3 | E88: 3 | F88: =SUM(#REF!) -> 8
A89: 1960 | B89: France (FRA) | C89: 1 | D89: 0 | E89: 2 | F89: =SUM(#REF!) -> 3
A90: 1960 | B90: Germany (GER) | C90: 4 | D90: 3 | E90: 1 | F90: =SUM(#REF!) -> 8
A91: 1960 | B91: Italy (ITA) | C91: 0 | D91: 0 | E91: 1 | F91: =SUM(#REF!) -> 1
A92: 1960 | B92: Netherlands (NED) | C92: 0 | D92: 1 | E92: 1 | F92: =SUM(#REF!) -> 2
A93: 1960 | B93: Norway (NOR) | C93: 3 | D93: 3 | E93: 0 | F93: =SUM(#REF!) -> 6
A94: 1960 | B94: Poland (POL) | C94: 0 | D94: 1 | E94: 1 | F94: =SUM(#REF!) -> 2
A95: 1960 | B95: Russia (RUS) | C95: 7 | D95: 5 | E95: 9 | F95: =SUM(#REF!) -> 21
A96: 1960 | B96: Sweden (SWE) | C96: 3 | D96: 2 | E96: 2 | F96: =SUM(#REF!) -> 7
A97: 1960 | B97: Switzerland (SUI) | C97: 2 | D97: 0 | E97: 0 | F97: =SUM(#REF!) -> 2
A98: 1960 | B98: United States (USA) | C98: 3 | D98: 4 | E98: 3 | F98: =SUM(#REF!) -> 10
A99: 1964 | B99: Austria (AUT) | C99: 4 | D99: 5 | E99: 3 | F99: =SUM(#REF!) -> 12
A100: 1964 | B100: Canada (CAN) | C100: 1 | D100: 0 | E100: 2 | F100: =SUM(#REF!) -> 3
A101: 1964 | B101: Czechoslovakia | C101: 0 | D101: 0 | E101: 1 | F101: =SUM(#REF!) -> 1
A102: 1964 | B102: Finland (FIN) | C102: 3 | D102: 4 | E102: 3 | F102: =SUM(#REF!) -> 10
A103: 1964 | B103: France (FRA) | C103: 3 | D103: 4 | E103: 0 | F103: =SUM(#REF!) -> 7
A104: 1964 | B104: Germany (GER) | C104: 3 | D104: 3 | E104: 3 | F104: =SUM(#REF!) -> 9
A105: 1964 | B105: Great Britain (GBR) | C105: 1 | D105: 0 | E105: 0 | F105: =SUM(#REF!) -> 1
A106: 1964 | B106: Italy (ITA) | C106: 0 | D106: 1 | E106: 3 | F106: =SUM(#REF!) -> 4
A107: 1964 | B107: Korea (KOR) | C107: 0 | D107: 1 | E107: 0 | F107: =SUM(#REF!) -> 1
A108: 1964 | B108: Netherlands (NED) | C108: 1 | D108: 1 | E108: 0 | F108: =SUM(#REF!) -> 2
A109: 1964 | B109: Norway (NOR) | C109: 3 | D109: 6 | E109: 6 | F109: =SUM(#REF!) -> 15
A110: 1964 | B110: Russia (RUS) | C110: 11 | D110: 8 | E110: 6 | F110: =SUM(#REF!) -> 25
A111: 1964 | B111: Sweden (SWE) | C111: 3 | D111: 3 | E111: 1 | F111: =SUM(#REF!) -> 7
A112: 1964 | B112: United States (USA) | C112: 1 | D112: 2 | E112: 3 | F112: =SUM(#REF!) -> 6
A113: 1968 | B113: Austria (AUT) | C113: 3 | D113: 4 | E113: 4 | F113: =SUM(#REF!) -> 11
A114: 1968 | B114: Canada (CAN) | C114: 1 | D114: 1 | E114: 1 | F114: =SUM(#REF!) -> 3
A115: 1968 | B115: Czechoslovakia | C115: 1 | D115: 2 | E115: 1 | F115: =SUM(#REF!) -> 4
A116: 1968 | B116: Finland (FIN) | C116: 1 | D116: 2 | E116: 2 | F116: =SUM(#REF!) -> 5
A117: 1968 | B117: France (FRA) | C117: 4 | D117: 3 | E117: 2 | F117: =SUM(#REF!) -> 9
A118: 1968 | B118: Germany (GER) | C118: 3 | D118: 4 | E118: 5 | F118: =SUM(#REF!) -> 12
A119: 1968 | B119: Italy (ITA) | C119: 4 | D119: 0 | E119: 0 | F119: =SUM(#REF!) -> 4
A120: 1968 | B120: Netherlands (NED) | C120: 3 | D120: 3 | E120: 3 | F120: =SUM(#REF!) -> 9
A121: 1968 | B121: Norway (NOR) | C121: 6 | D121: 6 | E121: 2 | F121: =SUM(#REF!) -> 14
A122: 1968 | B122: Romania | C122: 0 | D122: 0 | E122: 1 | F122: =SUM(#REF!) -> 1
A123: 1968 | B123: Russia (RUS) | C123: 5 | D123: 5 | E123: 3 | F123: =SUM(#REF!) -> 13
A124: 1968 | B124: Sweden (SWE) | C124: 3 | D124: 2 | E124: 3 | F124: =SUM(#REF!) -> 8
A125: 1968 | B125: Switzerland (SUI) | C125: 0 | D125: 2 | E125: 4 | F125: =SUM(#REF!) -> 6
A126: 1968 | B126: United States (USA) | C126: 1 | D126: 5 | E126: 1 | F126: =SUM(#REF!) -> 7
A127: 1972 | B127: Austria (AUT) | C127: 1 | D127: 2 | E127: 2 | F127: =SUM(#REF!) -> 5
A128: 1972 | B128: Canada (CAN) | C128: 0 | D128: 1 | E128: 0 | F128: =SUM(#REF!) -> 1
A129: 1972 | B129: Czechoslovakia | C129: 1 | D129: 0 | E129: 2 | F129: =SUM(#REF!) -> 3
A130: 1972 | B130: Finland (FIN) | C130: 0 | D130: 4 | E130: 1 | F130: =SUM(#REF!) -> 5
A131: 1972 | B131: France (FRA) | C131: 0 | D131: 1 | E131: 2 | F131: =SUM(#REF!) -> 3
A132: 1972 | B132: Germany (GER) | C132: 7 | D132: 4 | E132: 8 | F132: =SUM(#REF!) -> 19
A133: 1972 | B133: Italy (ITA) | C133: 2 | D133: 2 | E133: 1 | F133: =SUM(#REF!) -> 5
A134: 1972 | B134: Japan (JPN) | C134: 1 | D134: 1 | E134: 1 | F134: =SUM(#REF!) -> 3
A135: 1972 | B135: Netherlands (NED) | C135: 4 | D135: 3 | E135: 2 | F135: =SUM(#REF!) -> 9
A136: 1972 | B136: Norway (NOR) | C136: 2 | D136: 5 | E136: 5 | F136: =SUM(#REF!) -> 12
A137: 1972 | B137: Poland (POL) | C137: 1 | D137: 0 | E137: 0 | F137: =SUM(#REF!) -> 1
A138: 1972 | B138: Russia (RUS) | C138: 8 | D138: 5 | E138: 3 | F138: =SUM(#REF!) -> 16
A139: 1972 | B139: Spain (ESP) | C139: 1 | D139: 0 | E139: 0 | F139: =SUM(#REF!) -> 1
A140: 1972 | B140: Sweden (SWE) | C140: 1 | D140: 1 | E140: 2 | F140: =SUM(#REF!) -> 4
A141: 1972 | B141: Switzerland (SUI) | C141: 4 | D141: 3 | E141: 3 | F141: =SUM(#REF!) -> 10
A142: 1972 | B142: United States (USA) | C142: 3 | D142: 2 | E142: 3 | F142: =SUM(#REF!) -> 8
A143: 1976 | B143: Austria (AUT) | C143: 2 | D143: 2 | E143: 2 | F143: =SUM(#REF!) -> 6
A144: 1976 | B144: Canada (CAN) | C144: 1 | D144: 1 | E144: 1 | F144: =SUM(#REF!) -> 3
A145: 1976 | B145: Czechoslovakia | C145: 0 | D145: 1 | E145: 0 | F145: =SUM(#REF!) -> 1
A146: 1976 | B146: Finland (FIN) | C146: 2 | D146: 4 | E146: 1 | F146: =SUM(#REF!) -> 7
A147: 1976 | B147: France (FRA) | C147: 0 | D147: 0 | E147: 1 | F147: =SUM(#REF!) -> 1
A148: 1976 | B148: Germany (GER) | C148: 9 | D148: 10 | E148: 10 | F148: =SUM(#REF!) -> 29
A149: 1976 | B149: Great Britain (GBR) | C149: 1 | D149: 0 | E149: 0 | F149: =SUM(#REF!) -> 1
A150: 1976 | B150: Italy (ITA) | C150: 1 | D150: 2 | E150: 1 | F150: =SUM(#REF!) -> 4
A151: 1976 | B151: Liechtenstein (LIE) | C151: 0 | D151: 0 | E151: 2 | F151: =SUM(#REF!) -> 2
A152: 1976 | B152: Netherlands (NED) | C152: 1 | D152: 2 | E152: 3 | F152: =SUM(#REF!) -> 6
A153: 1976 | B153: Norway (NOR) | C153: 3 | D153: 3 | E153: 1 | F153: =SUM(#REF!) -> 7
A154: 1976 | B154: Russia (RUS) | C154: 13 | D154: 8 | E154: 6 | F154: =SUM(#REF!) -> 27
A155: 1976 | B155: Sweden (SWE) | C155: 0 | D155: 0 | E155: 2 | F155: =SUM(#REF!) -> 2
A156: 1976 | B156: Switzerland (SUI) | C156: 1 | D156: 3 | E156: 1 | F156: =SUM(#REF!) -> 5
A157: 1976 | B157: United States (USA) | C157: 3 | D157: 3 | E157: 4 | F157: =SUM(#REF!) -> 10
A158: 1980 | B158: Austria (AUT) | C158: 3 | D158: 2 | E158: 2 | F158: =SUM(#REF!) -> 7
A159: 1980 | B159: Bulgaria (BGR) | C159: 0 | D159: 0 | E159: 1 | F159: =SUM(#REF!) -> 1
A160: 1980 | B160: Canada (CAN) | C160: 0 | D160: 1 | E160: 1 | F160: =SUM(#REF!) -> 2
A161: 1980 | B161: Czechoslovakia | C161: 0 | D161: 0 | E161: 1 | F161: =SUM(#REF!) -> 1
A162: 1980 | B162: Finland (FIN) | C162: 1 | D162: 5 | E162: 3 | F162: =SUM(#REF!) -> 9
A163: 1980 | B163: France (FRA) | C163: 0 | D163: 0 | E163: 1 | F163: =SUM(#REF!) -> 1
A164: 1980 | B164: Germany (GER) | C164: 9 | D164: 9 | E164: 10 | F164: =SUM(#REF!) -> 28
A165: 1980 | B165: Great Britain (GBR) | C165: 1 | D165: 0 | E165: 0 | F165: =SUM(#REF!) -> 1
A166: 1980 | B166: Hungary (HUN) | C166: 0 | D166: 1 | E166: 0 | F166: =SUM(#REF!) -> 1
A167: 1980 | B167: Italy (ITA) | C167: 0 | D167: 2 | E167: 0 | F167: =SUM(#REF!) -> 2
A168: 1980 | B168: Japan (JPN) | C168: 0 | D168: 1 | E168: 0 | F168: =SUM(#REF!) -> 1
A169: 1980 | B169: Liechtenstein (LIE) | C169: 2 | D169: 2 | E169: 0 | F169: =SUM(#REF!) -> 4
A170: 1980 | B170: Netherlands (NED) | C170: 1 | D170: 2 | E170: 1 | F170: =SUM(#REF!) -> 4
A171: 1980 | B171: Norway (NOR) | C171: 1 | D171: 3 | E171: 6 | F171: =SUM(#REF!) -> 10
A172: 1980 | B172: Russia (RUS) | C172: 10 | D172: 6 | E172: 6 | F172: =SUM(#REF!) -> 22
A173: 1980 | B173: Sweden (SWE) | C173: 3 | D173: 0 | E173: 1 | F173: =SUM(#REF!) -> 4
A174: 1980 | B174: Switzerland (SUI) | C174: 1 | D174: 1 | E174: 3 | F174: =SUM(#REF!) -> 5
A175: 1980 | B175: United States (USA) | C175: 6 | D175: 4 | E175: 2 | F175: =SUM(#REF!) -> 12
A176: 1984 | B176: Austria (AUT) | C176: 0 | D176: 0 | E176: 1 | F176: =SUM(#REF!) -> 1
A177: 1984 | B177: Canada (CAN) | C177: 2 | D177: 1 | E177: 1 | F177: =SUM(#REF!) -> 4
A178: 1984 | B178: Czechoslovakia | C178: 0 | D178: 2 | E178: 4 | F178: =SUM(#REF!) -> 6
A179: 1984 | B179: Finland (FIN) | C179: 4 | D179: 3 | E179: 6 | F179: =SUM(#REF!) -> 13
A180: 1984 | B180: France (FRA) | C180: 0 | D180: 1 | E180: 2 | F180: =SUM(#REF!) -> 3
A181: 1984 | B181: Germany (GER) | C181: 11 | D181: 10 | E181: 7 | F181: =SUM(#REF!) -> 28
A182: 1984 | B182: Great Britain (GBR) | C182: 1 | D182: 0 | E182: 0 | F182: =SUM(#REF!) -> 1
A183: 1984 | B183: Italy (ITA) | C183: 2 | D183: 0 | E183: 0 | F183: =SUM(#REF!) -> 2
A184: 1984 | B184: Japan (JPN) | C184: 0 | D184: 1 | E184: 0 | F184: =SUM(#REF!) -> 1
A185: 1984 | B185: Liechtenstein (LIE) | C185: 0 | D185: 0 | E185: 2 | F185: =SUM(#REF!) -> 2
A186: 1984 | B186: Norway (NOR) | C186: 3 | D186: 2 | E186: 4 | F186: =SUM(#REF!) -> 9
A187: 1984 | B187: Russia (RUS) | C187: 6 | D187: 10 | E187: 9 | F187: =SUM(#REF!) -> 25
A188: 1984 | B188: Sweden (SWE) | C188: 4 | D188: 2 | E188: 2 | F188: =SUM(#REF!) -> 8
A189: 1984 | B189: Switzerland (SUI) | C189: 2 | D189: 2 | E189: 1 | F189: =SUM(#REF!) -> 5
A190: 1984 | B190: United States (USA) | C190: 4 | D190: 4 | E190: 0 | F190: =SUM(#REF!) -> 8
A191: 1984 | B191: Yugoslavia | C191: 0 | D191: 1 | E191: 0 | F191: =SUM(#REF!) -> 1
A192: 1988 | B192: Austria (AUT) | C192: 3 | D192: 5 | E192: 2 | F192: =SUM(#REF!) -> 10
A193: 1988 | B193: Canada (CAN) | C193: 0 | D193: 2 | E193: 3 | F193: =SUM(#REF!) -> 5
A194: 1988 | B194: Czechoslovakia | C194: 0 | D194: 1 | E194: 2 | F194: =SUM(#REF!) -> 3
A195: 1988 | B195: Finland (FIN) | C195: 4 | D195: 1 | E195: 2 | F195: =SUM(#REF!) -> 7
A196: 1988 | B196: France (FRA) | C196: 1 | D196: 0 | E196: 1 | F196: =SUM(#REF!) -> 2
A197: 1988 | B197: Germany (GER) | C197: 11 | D197: 14 | E197: 8 | F197: =SUM(#REF!) -> 33
A198: 1988 | B198: Italy (ITA) | C198: 2 | D198: 1 | E198: 2 | F198: =SUM(#REF!) -> 5
A199: 1988 | B199: Japan (JPN) | C199: 0 | D199: 0 | E199: 1 | F199: =SUM(#REF!) -> 1
A200: 1988 | B200: Liechtenstein (LIE) | C200: 0 | D200: 0 | E200: 1 | F200: =SUM(#REF!) -> 1
A201: 1988 | B201: Netherlands (NED) | C201: 3 | D201: 2 | E201: 2 | F201: =SUM(#REF!) -> 7
A202: 1988 | B202: Norway (NOR) | C202: 0 | D202: 3 | E202: 2 | F202: =SUM(#REF!) -> 5
A203: 1988 | B203: Russia (RUS) | C203: 11 | D203: 9 | E203: 9 | F203: =SUM(#REF!) -> 29
A204: 1988 | B204: Sweden (SWE) | C204: 4 | D204: 0 | E204: 2 | F204: =SUM(#REF!) -> 6
A205: 1988 | B205: Switzerland (SUI) | C205: 5 | D205: 5 | E205: 5 | F205: =SUM(#REF!) -> 15
A206: 1988 | B206: United States (USA) | C206: 2 | D206: 1 | E206: 3 | F206: =SUM(#REF!) -> 6
A207: 1988 | B207: Yugoslavia | C207: 0 | D207: 2 | E207: 1 | F207: =SUM(#REF!) -> 3
A208: 1992 | B208: Austria (AUT) | C208: 6 | D208: 7 | E208: 8 | F208: =SUM(#REF!) -> 21
A209: 1992 | B209: Canada (CAN) | C209: 2 | D209: 3 | E209: 2 | F209: =SUM(#REF!) -> 7
A210: 1992 | B210: China (CHN) | C210: 0 | D210: 3 | E210: 0 | F210: =SUM(#REF!) -> 3
A211: 1992 | B211: Czech Republic (CZE) | C211: 0 | D211: 0 | E211: 3 | F211: =SUM(#REF!) -> 3
A212: 1992 | B212: Finland (FIN) | C212: 3 | D212: 1 | E212: 3 | F212: =SUM(#REF!) -> 7
A213: 1992 | B213: France (FRA) | C213: 3 | D213: 5 | E213: 1 | F213: =SUM(#REF!) -> 9
A214: 1992 | B214: Germany (GER) | C214: 10 | D214: 10 | E214: 6 | F214: =SUM(#REF!) -> 26
A215: 1992 | B215: Italy (ITA) | C215: 4 | D215: 6 | E215: 4 | F215: =SUM(#REF!) -> 14
A216: 1992 | B216: Japan (JPN) | C216: 1 | D216: 2 | E216: 4 | F216: =SUM(#REF!) -> 7
A217: 1992 | B217: Korea (KOR) | C217: 2 | D217: 1 | E217: 3 | F217: =SUM(#REF!) -> 6
A218: 1992 | B218: Luxembourg (LUX) | C218: 0 | D218: 2 | E218: 0 | F218: =SUM(#REF!) -> 2
A219: 1992 | B219: Netherlands (NED) | C219: 1 | D219: 1 | E219: 2 | F219: =SUM(#REF!) -> 4
A220: 1992 | B220: New Zealand (NZL) | C220: 0 | D220: 1 | E220: 0 | F220: =SUM(#REF!) -> 1
A221: 1992 | B221: Norway (NOR) | C221: 9 | D221: 6 | E221: 5 | F221: =SUM(#REF!) -> 20
A222: 1992 | B222: Russia (RUS) | C222: 9 | D222: 6 | E222: 8 | F222: =SUM(#REF!) -> 23
A223: 1992 | B223: Spain (ESP) | C223: 0 | D223: 0 | E223: 1 | F223: =SUM(#REF!) -> 1
A224: 1992 | B224: Sweden (SWE) | C224: 1 | D224: 0 | E224: 3 | F224: =SUM(#REF!) -> 4
A225: 1992 | B225: Switzerland (SUI) | C225: 1 | D225: 0 | E225: 2 | F225: =SUM(#REF!) -> 3
A226: 1992 | B226: United States (USA) | C226: 5 | D226: 4 | E226: 2 | F226: =SUM(#REF!) -> 11
A227: 1994 | B227: Australia (AUS) | C227: 0 | D227: 0 | E227: 1 | F227: =SUM(#REF!) -> 1
A228: 1994 | B228: Austria (AUT) | C228: 2 | D228: 3 | E228: 4 | F228: =SUM(#REF!) -> 9
A229: 1994 | B229: Belarus (BLR) | C229: 0 | D229: 2 | E229: 0 | F229: =SUM(#REF!) -> 2
A230: 1994 | B230: Canada (CAN) | C230: 3 | D230: 6 | E230: 4 | F230: =SUM(#REF!) -> 13
A231: 1994 | B231: China (CHN) | C231: 0 | D231: 1 | E231: 2 | F231: =SUM(#REF!) -> 3
A232: 1994 | B232: Finland (FIN) | C232: 0 | D232: 1 | E232: 5 | F232: =SUM(#REF!) -> 6
A233: 1994 | B233: France (FRA) | C233: 0 | D233: 1 | E233: 4 | F233: =SUM(#REF!) -> 5
A234: 1994 | B234: Germany (GER) | C234: 9 | D234: 7 | E234: 8 | F234: =SUM(#REF!) -> 24
A235: 1994 | B235: Great Britain (GBR) | C235: 0 | D235: 0 | E235: 2 | F235: =SUM(#REF!) -> 2
A236: 1994 | B236: Italy (ITA) | C236: 7 | D236: 5 | E236: 8 | F236: =SUM(#REF!) -> 20
A237: 1994 | B237: Japan (JPN) | C237: 1 | D237: 2 | E237: 2 | F237: =SUM(#REF!) -> 5
A238: 1994 | B238: Kazakhstan (KAZ) | C238: 1 | D238: 2 | E238: 0 | F238: =SUM(#REF!) -> 3
A239: 1994 | B239: Korea (KOR) | C239: 4 | D239: 1 | E239: 1 | F239: =SUM(#REF!) -> 6
A240: 1994 | B240: Netherlands (NED) | C240: 0 | D240: 1 | E240: 3 | F240: =SUM(#REF!) -> 4
A241: 1994 | B241: Norway (NOR) | C241: 10 | D241: 11 | E241: 5 | F241: =SUM(#REF!) -> 26
A242: 1994 | B242: Russia (RUS) | C242: 11 | D242: 8 | E242: 4 | F242: =SUM(#REF!) -> 23
A243: 1994 | B243: Slovenia (SLO) | C243: 0 | D243: 0 | E243: 3 | F243: =SUM(#REF!) -> 3
A244: 1994 | B244: Sweden (SWE) | C244: 2 | D244: 1 | E244: 0 | F244: =SUM(#REF!) -> 3
A245: 1994 | B245: Switzerland (SUI) | C245: 3 | D245: 4 | E245: 2 | F245: =SUM(#REF!) -> 9
A246: 1994 | B246: Ukraine (UKR) | C246: 1 | D246: 0 | E246: 1 | F246: =SUM(#REF!) -> 2
A247: 1994 | B247: United States (USA) | C247: 6 | D247: 5 | E247: 2 | F247: =SUM(#REF!) -> 13
A248: 1994 | B248: Uzbekistan (UZB) | C248: 1 | D248: 0 | E248: 0 | F248: =SUM(#REF!) -> 1
A249: 1998 | B249: Australia (AUS) | C249: 0 | D249: 0 | E249: 1 | F249: =SUM(#REF!) -> 1
A250: 1998 | B250: Austria (AUT) | C250: 3 | D250: 5 | E250: 9 | F250: =SUM(#REF!) -> 17
A251: 1998 | B251: Belarus (BLR) | C251: 0 | D251: 0 | E251: 2 | F251: =SUM(#REF!) -> 2
A252: 1998 | B252: Belgium (BEL) | C252: 0 | D252: 0 | E252: 1 | F252: =SUM(#REF!) -> 1
A253: 1998 | B253: Bulgaria (BGR) | C253: 1 | D253: 0 | E253: 0 | F253: =SUM(#REF!) -> 1
A254: 1998 | B254: Canada (CAN) | C254: 6 | D254: 5 | E254: 4 | F254: =SUM(#REF!) -> 15
A255: 1998 | B255: China (CHN) | C255: 0 | D255: 6 | E255: 2 | F255: =SUM(#REF!) -> 8
A256: 1998 | B256: Denmark (DNK) | C256: 0 | D256: 1 | E256: 0 | F256: =SUM(#REF!) -> 1
A257: 1998 | B257: Finland (FIN) | C257: 2 | D257: 4 | E257: 6 | F257: =SUM(#REF!) -> 12
A258: 1998 | B258: France (FRA) | C258: 2 | D258: 1 | E258: 5 | F258: =SUM(#REF!) -> 8
A259: 1998 | B259: Germany (GER) | C259: 12 | D259: 9 | E259: 8 | F259: =SUM(#REF!) -> 29
A260: 1998 | B260: Great Britain (GBR) | C260: 0 | D260: 0 | E260: 1 | F260: =SUM(#REF!) -> 1
A261: 1998 | B261: Italy (ITA) | C261: 2 | D261: 6 | E261: 2 | F261: =SUM(#REF!) -> 10
A262: 1998 | B262: Japan (JPN) | C262: 5 | D262: 1 | E262: 4 | F262: =SUM(#REF!) -> 10
A263: 1998 | B263: Kazakhstan (KAZ) | C263: 0 | D263: 0 | E263: 2 | F263: =SUM(#REF!) -> 2
A264: 1998 | B264: Korea (KOR) | C264: 3 | D264: 1 | E264: 2 | F264: =SUM(#REF!) -> 6
A265: 1998 | B265: Netherlands (NED) | C265: 5 | D265: 4 | E265: 2 | F265: =SUM(#REF!) -> 11
A266: 1998 | B266: Norway (NOR) | C266: 10 | D266: 10 | E266: 5 | F266: =SUM(#REF!) -> 25
A267: 1998 | B267: Russia (RUS) | C267: 9 | D267: 6 | E267: 3 | F267: =SUM(#REF!) -> 18
A268: 1998 | B268: Sweden (SWE) | C268: 0 | D268: 2 | E268: 1 | F268: =SUM(#REF!) -> 3
A269: 1998 | B269: Switzerland (SUI) | C269: 2 | D269: 2 | E269: 3 | F269: =SUM(#REF!) -> 7
A270: 1998 | B270: Ukraine (UKR) | C270: 0 | D270: 1 | E270: 0 | F270: =SUM(#REF!) -> 1
A271: 1998 | B271: Ukraine (UKR) | C271: 0 | D271: 1 | E271: 0 | F271: =SUM(#REF!) -> 1
A272: 1998 | B272: United States (USA) | C272: 6 | D272: 3 | E272: 4 | F272: =SUM(#REF!) -> 13
A273: 2002 | B273: Australia (AUS) | C273: 2 | D273: 0 | E273: 0 | F273: =SUM(#REF!) -> 2
A274: 2002 | B274: Austria (AUT) | C274: 3 | D274: 4 | E274: 10 | F274: =SUM(#REF!) -> 17
A275: 2002 | B275: Belarus (BLR) | C275: 0 | D275: 0 | E275: 1 | F275: =SUM(#REF!) -> 1
A276: 2002 | B276: Bulgaria (BGR) | C276: 0 | D276: 1 | E276: 2 | F276: =SUM(#REF!) -> 3
A277: 2002 | B277: Canada (CAN) | C277: 7 | D277: 3 | E277: 7 | F277: =SUM(#REF!) -> 17
A278: 2002 | B278: China (CHN) | C278: 2 | D278: 2 | E278: 4 | F278: =SUM(#REF!) -> 8
A279: 2002 | B279: Croatia (HRV) | C279: 3 | D279: 1 | E279: 0 | F279: =SUM(#REF!) -> 4
A280: 2002 | B280: Czech Republic (CZE) | C280: 1 | D280: 2 | E280: 0 | F280: =SUM(#REF!) -> 3
A281: 2002 | B281: Estonia (EST) | C281: 1 | D281: 1 | E281: 1 | F281: =SUM(#REF!) -> 3
A282: 2002 | B282: Finland (FIN) | C282: 4 | D282: 2 | E282: 1 | F282: =SUM(#REF!) -> 7
A283: 2002 | B283: France (FRA) | C283: 4 | D283: 5 | E283: 2 | F283: =SUM(#REF!) -> 11
A284: 2002 | B284: Germany (GER) | C284: 12 | D284: 16 | E284: 8 | F284: =SUM(#REF!) -> 36
A285: 2002 | B285: Great Britain (GBR) | C285: 1 | D285: 0 | E285: 1 | F285: =SUM(#REF!) -> 2
A286: 2002 | B286: Italy (ITA) | C286: 4 | D286: 4 | E286: 5 | F286: =SUM(#REF!) -> 13
A287: 2002 | B287: Japan (JPN) | C287: 0 | D287: 1 | E287: 1 | F287: =SUM(#REF!) -> 2
A288: 2002 | B288: Korea (KOR) | C288: 2 | D288: 2 | E288: 0 | F288: =SUM(#REF!) -> 4
A289: 2002 | B289: Netherlands (NED) | C289: 3 | D289: 5 | E289: 0 | F289: =SUM(#REF!) -> 8
A290: 2002 | B290: Norway (NOR) | C290: 13 | D290: 5 | E290: 7 | F290: =SUM(#REF!) -> 25
A291: 2002 | B291: Poland (POL) | C291: 0 | D291: 1 | E291: 1 | F291: =SUM(#REF!) -> 2
A292: 2002 | B292: Russia (RUS) | C292: 5 | D292: 4 | E292: 4 | F292: =SUM(#REF!) -> 13
A293: 2002 | B293: Slovenia (SLO) | C293: 0 | D293: 0 | E293: 1 | F293: =SUM(#REF!) -> 1
A294: 2002 | B294: Sweden (SWE) | C294: 0 | D294: 2 | E294: 5 | F294: =SUM(#REF!) -> 7
A295: 2002 | B295: Switzerland (SUI) | C295: 3 | D295: 2 | E295: 6 | F295: =SUM(#REF!) -> 11
A296: 2002 | B296: United States (USA) | C296: 10 | D296: 13 | E296: 11 | F296: =SUM(#REF!) -> 34
A297: 2006 | B297: Australia (AUS) | C297: 1 | D297: 0 | E297: 1 | F297: =SUM(#REF!) -> 2
A298: 2006 | B298: Austria (AUT) | C298: 9 | D298: 7 | E298: 7 | F298: =SUM(#REF!) -> 23
A299: 2006 | B299: Belarus (BLR) | C299: 0 | D299: 1 | E299: 0 | F299: =SUM(#REF!) -> 1
A300: 2006 | B300: Bulgaria (BGR) | C300: 0 | D300: 1 | E300: 0 | F300: =SUM(#REF!) -> 1
A301: 2006 | B301: Canada (CAN) | C301: 7 | D301: 10 | E301: 7 | F301: =SUM(#REF!) -> 24
A302: 2006 | B302: China (CHN) | C302: 2 | D302: 4 | E302: 5 | F302: =SUM(#REF!) -> 11
A303: 2006 | B303: Croatia (HRV) | C303: 1 | D303: 2 | E303: 0 | F303: =SUM(#REF!) -> 3
A304: 2006 | B304: Czech Republic (CZE) | C304: 1 | D304: 2 | E304: 1 | F304: =SUM(#REF!) -> 4
A305: 2006 | B305: Estonia (EST) | C305: 3 | D305: 0 | E305: 0 | F305: =SUM(#REF!) -> 3
A306: 2006 | B306: Finland (FIN) | C306: 0 | D306: 6 | E306: 3 | F306: =SUM(#REF!) -> 9
A307: 2006 | B307: France (FRA) | C307: 3 | D307: 2 | E307: 4 | F307: =SUM(#REF!) -> 9
A308: 2006 | B308: Germany (GER) | C308: 11 | D308: 12 | E308: 6 | F308: =SUM(#REF!) -> 29
A309: 2006 | B309: Great Britain (GBR) | C309: 0 | D309: 1 | E309: 0 | F309: =SUM(#REF!) -> 1
A310: 2006 | B310: Italy (ITA) | C310: 5 | D310: 0 | E310: 6 | F310: =SUM(#REF!) -> 11
A311: 2006 | B311: Japan (JPN) | C311: 1 | D311: 0 | E311: 0 | F311: =SUM(#REF!) -> 1
A312: 2006 | B312: Korea (KOR) | C312: 6 | D312: 3 | E312: 2 | F312: =SUM(#REF!) -> 11
A313: 2006 | B313: Latvia (LVA) | C313: 0 | D313: 0 | E313: 1 | F313: =SUM(#REF!) -> 1
A314: 2006 | B314: Netherlands (NED) | C314: 3 | D314: 2 | E314: 4 | F314: =SUM(#REF!) -> 9
A315: 2006 | B315: Norway (NOR) | C315: 2 | D315: 8 | E315: 9 | F315: =SUM(#REF!) -> 19
A316: 2006 | B316: Poland (POL) | C316: 0 | D316: 1 | E316: 1 | F316: =SUM(#REF!) -> 2
A317: 2006 | B317: Russia (RUS) | C317: 8 | D317: 6 | E317: 8 | F317: =SUM(#REF!) -> 22
A318: 2006 | B318: Slovakia (SVK) | C318: 0 | D318: 1 | E318: 0 | F318: =SUM(#REF!) -> 1
A319: 2006 | B319: Sweden (SWE) | C319: 7 | D319: 2 | E319: 5 | F319: =SUM(#REF!) -> 14
A320: 2006 | B320: Switzerland (SUI) | C320: 5 | D320: 4 | E320: 5 | F320: =SUM(#REF!) -> 14
A321: 2006 | B321: Ukraine (UKR) | C321: 0 | D321: 0 | E321: 2 | F321: =SUM(#REF!) -> 2
A322: 2006 | B322: United States (USA) | C322: 9 | D322: 9 | E322: 7 | F322: =SUM(#REF!) -> 25
A323: 2010 | B323: Australia (AUS) | C323: 2 | D323: 1 | E323: 0 | F323: =SUM(#REF!) -> 3
A324: 2010 | B324: Austria (AUT) | C324: 4 | D324: 6 | E324: 6 | F324: =SUM(#REF!) -> 16
A325: 2010 | B325: Belarus (BLR) | C325: 1 | D325: 1 | E325: 1 | F325: =SUM(#REF!) -> 3
A326: 2010 | B326: Canada (CAN) | C326: 14 | D326: 7 | E326: 5 | F326: =SUM(#REF!) -> 26
A327: 2010 | B327: China (CHN) | C327: 5 | D327: 2 | E327: 4 | F327: =SUM(#REF!) -> 11
A328: 2010 | B328: Croatia (HRV) | C328: 0 | D328: 2 | E328: 1 | F328: =SUM(#REF!) -> 3
A329: 2010 | B329: Czech Republic (CZE) | C329: 2 | D329: 0 | E329: 4 | F329: =SUM(#REF!) -> 6
A330: 2010 | B330: Estonia (EST) | C330: 0 | D330: 1 | E330: 0 | F330: =SUM(#REF!) -> 1
A331: 2010 | B331: Finland (FIN) | C331: 0 | D331: 1 | E331: 4 | F331: =SUM(#REF!) -> 5
A332: 2010 | B332: France (FRA) | C332: 2 | D332: 3 | E332: 6 | F332: =SUM(#REF!) -> 11
A333: 2010 | B333: Germany (GER) | C333: 10 | D333: 13 | E333: 7 | F333: =SUM(#REF!) -> 30
A334: 2010 | B334: Great Britain (GBR) | C334: 1 | D334: 0 | E334: 0 | F334: =SUM(#REF!) -> 1
A335: 2010 | B335: Italy (ITA) | C335: 1 | D335: 1 | E335: 3 | F335: =SUM(#REF!) -> 5
A336: 2010 | B336: Japan (JPN) | C336: 0 | D336: 3 | E336: 2 | F336: =SUM(#REF!) -> 5
A337: 2010 | B337: Kazakhstan (KAZ) | C337: 0 | D337: 1 | E337: 0 | F337: =SUM(#REF!) -> 1
A338: 2010 | B338: Korea (KOR) | C338: 6 | D338: 6 | E338: 2 | F338: =SUM(#REF!) -> 14
A339: 2010 | B339: Latvia (LVA) | C339: 0 | D339: 2 | E339: 0 | F339: =SUM(#REF!) -> 2
A340: 2010 | B340: Netherlands (NED) | C340: 4 | D340: 1 | E340: 3 | F340: =SUM(#REF!) -> 8
A341: 2010 | B341: Norway (NOR) | C341: 9 | D341: 8 | E341: 6 | F341: =SUM(#REF!) -> 23
A342: 2010 | B342: Poland (POL) | C342: 1 | D342: 3 | E342: 2 | F342: =SUM(#REF!) -> 6
A343: 2010 | B343: Russia (RUS) | C343: 3 | D343: 5 | E343: 7 | F343: =SUM(#REF!) -> 15
A344: 2010 | B344: Slovakia (SVK) | C344: 1 | D344: 1 | E344: 1 | F344: =SUM(#REF!) -> 3
A345: 2010 | B345: Slovenia (SLO) | C345: 0 | D345: 2 | E345: 1 | F345: =SUM(#REF!) -> 3
A346: 2010 | B346: Sweden (SWE) | C346: 5 | D346: 2 | E346: 4 | F346: =SUM(#REF!) -> 11
A347: 2010 | B347: Switzerland (SUI) | C347: 6 | D347: 0 | E347: 3 | F347: =SUM(#REF!) -> 9
A348: 2010 | B348: United States (USA) | C348: 9 | D348: 15 | E348: 13 | F348: =SUM(#REF!) -> 37
A349: 2014 | B349: Australia (AUS) | C349: 4 | D349: 8 | E349: 5 | F349: =SUM(#REF!) -> 17
A350: 2014 | B350: Australia (AUS) | C350: 0 | D350: 2 | E350: 1 | F350: =SUM(#REF!) -> 3
A351: 2014 | B351: Belarus (BLR) | C351: 5 | D351: 0 | E351: 1 | F351: =SUM(#REF!) -> 6
A352: 2014 | B352: Canada (CAN) | C352: 10 | D352: 10 | E352: 5 | F352: =SUM(#REF!) -> 25
A353: 2014 | B353: China (CHN) | C353: 3 | D353: 4 | E353: 2 | F353: =SUM(#REF!) -> 9
A354: 2014 | B354: Croatia (HRV) | C354: 0 | D354: 1 | E354: 0 | F354: =SUM(#REF!) -> 1
A355: 2014 | B355: Czech Republic (CZE) | C355: 2 | D355: 4 | E355: 2 | F355: =SUM(#REF!) -> 8
A356: 2014 | B356: Finland (FIN) | C356: 1 | D356: 3 | E356: 1 | F356: =SUM(#REF!) -> 5
A357: 2014 | B357: France (FRA) | C357: 4 | D357: 4 | E357: 7 | F357: =SUM(#REF!) -> 15
A358: 2014 | B358: Germany (GER) | C358: 8 | D358: 6 | E358: 5 | F358: =SUM(#REF!) -> 19
A359: 2014 | B359: Great Britain (GBR) | C359: 1 | D359: 1 | E359: 2 | F359: =SUM(#REF!) -> 4
A360: 2014 | B360: Italy (ITA) | C360: 0 | D360: 2 | E360: 6 | F360: =SUM(#REF!) -> 8
A361: 2014 | B361: Japan (JPN) | C361: 1 | D361: 4 | E361: 3 | F361: =SUM(#REF!) -> 8
A362: 2014 | B362: Kazakhstan (KAZ) | C362: 0 | D362: 0 | E362: 1 | F362: =SUM(#REF!) -> 1
A363: 2014 | B363: Korea (KOR) | C363: 3 | D363: 3 | E363: 2 | F363: =SUM(#REF!) -> 8
A364: 2014 | B364: Latvia LVA) | C364: 0 | D364: 2 | E364: 2 | F364: =SUM(#REF!) -> 4
A365: 2014 | B365: Netherlands (NED) | C365: 8 | D365: 7 | E365: 9 | F365: =SUM(#REF!) -> 24
A366: 2014 | B366: Norway (NOR) | C366: 11 | D366: 5 | E366: 10 | F366: =SUM(#REF!) -> 26
A367: 2014 | B367: Poland (POL) | C367: 4 | D367: 1 | E367: 1 | F367: =SUM(#REF!) -> 6
A368: 2014 | B368: Russia (RUS) | C368: 13 | D368: 11 | E368: 9 | F368: =SUM(#REF!) -> 33
A369: 2014 | B369: Slovakia (SVK) | C369: 1 | D369: 0 | E369: 0 | F369: =SUM(#REF!) -> 1
A370: 2014 | B370: Slovenia (SLO) | C370: 2 | D370: 2 | E370: 4 | F370: =SUM(#REF!) -> 8
A371: 2014 | B371: Sweden (SWE) | C371: 2 | D371: 7 | E371: 6 | F371: =SUM(#REF!) -> 15
A372: 2014 | B372: Switzerland (SUI) | C372: 6 | D372: 3 | E372: 2 | F372: =SUM(#REF!) -> 11
A373: 2014 | B373: Ukraine (UKR) | C373: 1 | D373: 0 | E373: 1 | F373: =SUM(#REF!) -> 2
A374: 2014 | B374: United States (USA) | C374: 9 | D374: 7 | E374: 12 | F374: =SUM(#REF!) -> 28

Sheet: Sochi Olympic stats
A1: Sochi Winter Olympic Stats
A2: Year | B2: Nation | C2: Gold Medals | D2: Silver Medals | E2: Bronze Medals | F2: Total Medals | G2: # Athletes | H2: # Sports | I2: # per Athlete | J2: Population | K2: Hemisphere | L2: Area (km2) | M2: Continent
A3: 2014 | B3: Russia (RUS) | C3: 13 | D3: 11 | E3: 9 | F3: =SUM(RC[-3]:RC[-1]) -> 33 | G3: 232 | H3: 15 | I3: =RC[-3]/RC[-2] -> 0.14224137931034483 | J3: 143700000 | K3: north | L3: 17098242 | M3: Europe
A4: 2014 | B4: Norway (NOR) | C4: 11 | D4: 5 | E4: 10 | F4: =SUM(RC[-3]:RC[-1]) -> 26 | G4: 134 | H4: 12 | I4: =RC[-3]/RC[-2] -> 0.19402985074626866 | J4: 5136700 | K4: north | L4: 385178 | M4: Europe
A5: 2014 | B5: Canada (CAN) | C5: 10 | D5: 10 | E5: 5 | F5: =SUM(RC[-3]:RC[-1]) -> 25 | G5: 222 | H5: 14 | I5: =RC[-3]/RC[-2] -> 0.11261261261261261 | J5: 35158300 | K5: north | L5: 9984670 | M5: North America
A6: 2014 | B6: France (FRA) | C6: 4 | D6: 4 | E6: 7 | F6: =SUM(RC[-3]:RC[-1]) -> 15 | G6: 116 | H6: 12 | I6: =RC[-3]/RC[-2] -> 0.12931034482758622 | J6: 66616416 | K6: north | L6: 640679 | M6: Europe
A7: 2014 | B7: Germany (GER) | C7: 8 | D7: 6 | E7: 5 | F7: =SUM(RC[-3]:RC[-1]) -> 19 | G7: 153 | H7: 15 | I7: =RC[-3]/RC[-2] -> 0.12418300653594772 | J7: 80585700 | K7: north | L7: 357168 | M7: Europe
A8: 2014 | B8: Great Britain (GBR) | C8: 1 | D8: 1 | E8: 2 | F8: =SUM(RC[-3]:RC[-1]) -> 4 | G8: 56 | H8: 10 | I8: =RC[-3]/RC[-2] -> 7.1428571428571425E-2 | J8: 63705000 | K8: north | L8: 243610 | M8: Europe
A9: 2014 | B9: Switzerland (CHE) | C9: 6 | D9: 3 | E9: 2 | F9: =SUM(RC[-3]:RC[-1]) -> 11 | G9: 163 | H9: 12 | I9: =RC[-3]/RC[-2] -> 6.7484662576687116E-2 | J9: 8014000 | K9: north | L9: 41285 | M9: Europe
A10: 2014 | B10: Belarus (BLR) | C10: 5 | D10: 0 | E10: 1 | F10: =SUM(RC[-3]:RC[-1]) -> 6 | G10: 26 | H10: 5 | I10: =RC[-3]/RC[-2] -> 0.23076923076923078 | J10: 9457500 | K10: north | L10: 207595 | M10: Europe
A11: 2014 | B11: Austria (AUT) | C11: 4 | D11: 8 | E11: 5 | F11: =SUM(RC[-3]:RC[-1]) -> 17 | G11: 132 | H11: 14 | I11: =RC[-3]/RC[-2] -> 0.12878787878787878 | J11: 8414638 | K11: north | L11: 83855 | M11: Europe
A12: 2014 | B12: Poland (POL) | C12: 4 | D12: 1 | E12: 1 | F12: =SUM(RC[-3]:RC[-1]) -> 6 | G12: 59 | H12: 11 | I12: =RC[-3]/RC[-2] -> 0.10169491525423729 | J12: 38186860 | K12: north | L12: 312679 | M12: Europe
A13: 2014 | B13: China (CHN) | C13: 3 | D13: 4 | E13: 2 | F13: =SUM(RC[-3]:RC[-1]) -> 9 | G13: 66 | H13: 9 | I13: =RC[-3]/RC[-2] -> 0.13636363636363635 | J13: 1350695000 | K13: north | L13: 9596961 | M13: Asia
A14: 2014 | B14: Sweden (SWE) | C14: 2 | D14: 7 | E14: 6 | F14: =SUM(RC[-3]:RC[-1]) -> 15 | G14: 106 | H14: 9 | I14: =RC[-3]/RC[-2] -> 0.14150943396226415 | J14: 9644864 | K14: north | L14: 449964 | M14: Eurasia
A15: 2014 | B15: Netherlands (NED) | C15: 8 | D15: 7 | E15: 9 | F15: =SUM(RC[-3]:RC[-1]) -> 24 | G15: 41 | H15: 4 | I15: =RC[-3]/RC[-2] -> 0.58536585365853655 | J15: 16819595 | K15: north | L15: 41543 | M15: Europe
A16: 2014 | B16: Czech Republic (CZE) | C16: 2 | D16: 4 | E16: 2 | F16: =SUM(RC[-3]:RC[-1]) -> 8 | G16: 88 | H16: 13 | I16: =RC[-3]/RC[-2] -> 9.0909090909090912E-2 | J16: 10513209 | K16: north | L16: 78866 | M16: Europe
A17: 2014 | B17: Slovenia (SLO) | C17: 2 | D17: 2 | E17: 4 | F17: =SUM(RC[-3]:RC[-1]) -> 8 | G17: 66 | H17: 8 | I17: =RC[-3]/RC[-2] -> 0.12121212121212122 | J17: 20273 | K17: north | L17: 2055496 | M17: Europe
A18: 2014 | B18: Italy (ITA) | C18: 0 | D18: 2 | E18: 6 | F18: =SUM(RC[-3]:RC[-1]) -> 8 | G18: 113 | H18: 13 | I18: =RC[-3]/RC[-2] -> 7.0796460176991149E-2 | J18: 59943933 | K18: north | L18: 301338 | M18: Europe
A19: 2014 | B19: Latvia LVA) | C19: 0 | D19: 2 | E19: 2 | F19: =SUM(RC[-3]:RC[-1]) -> 4 | G19: 58 | H19: 9 | I19: =RC[-3]/RC[-2] -> 6.8965517241379309E-2 | J19: 2003000 | K19: north | L19: 64589 | M19: Europe
A20: 2014 | B20: Australia (AUS) | C20: 0 | D20: 2 | E20: 1 | F20: =SUM(RC[-3]:RC[-1]) -> 3 | G20: 60 | H20: 11 | I20: =RC[-3]/RC[-2] -> 0.05 | J20: 23427253 | K20: south | L20: 7692024 | M20: Australia
A21: 2014 | B21: Croatia (HRV) | C21: 0 | D21: 1 | E21: 0 | F21: =SUM(RC[-3]:RC[-1]) -> 1 | G21: 11 | H21: 3 | I21: =RC[-3]/RC[-2] -> 9.0909090909090912E-2 | J21: 4284889 | K21: north | L21: 4284889 | M21: Europe
A22: 2014 | B22: Kazakhstan (KAZ) | C22: 0 | D22: 0 | E22: 1 | F22: =SUM(RC[-3]:RC[-1]) -> 1 | G22: 52 | H22: 10 | I22: =RC[-3]/RC[-2] -> 1.9230769230769232E-2 | J22: 17736896 | K22: north | L22: 2724900 | M22: Asia
A23: 2014 | B23: South Korea (KOR) | C23: 3 | D23: 3 | E23: 2 | F23: =SUM(RC[-3]:RC[-1]) -> 8 | G23: 71 | H23: 13 | I23: =RC[-3]/RC[-2] -> 0.11267605633802817 | J23: 50219669 | K23: north | L23: 100210 | M23: Asia
A24: 2014 | B24: Ukraine (UKR) | C24: 1 | D24: 0 | E24: 1 | F24: =SUM(RC[-3]:RC[-1]) -> 2 | G24: 45 | H24: 9 | I24: =RC[-3]/RC[-2] -> 4.4444444444444446E-2 | J24: 44573205 | K24: north | L24: 603628 | M24: Europe
A25: 2014 | B25: United States (USA) | C25: 9 | D25: 7 | E25: 12 | F25: =SUM(RC[-3]:RC[-1]) -> 28 | G25: 230 | H25: 15 | I25: =RC[-3]/RC[-2] -> 0.12173913043478261 | J25: 317757000 | K25: north | L25: 9826675 | M25: North America
A26: 2014 | B26: Japan (JPN) | C26: 1 | D26: 4 | E26: 3 | F26: =SUM(RC[-3]:RC[-1]) -> 8 | G26: 136 | H26: 15 | I26: =RC[-3]/RC[-2] -> 5.8823529411764705E-2 | J26: 126659683 | K26: north | L26: 377944 | M26: Asia
A27: 2014 | B27: Finland (FIN) | C27: 1 | D27: 3 | E27: 1 | F27: =SUM(RC[-3]:RC[-1]) -> 5 | G27: 103 | H27: 9 | I27: =RC[-3]/RC[-2] -> 4.8543689320388349E-2 | J27: 5454444 | K27: north | L27: 338424 | M27: Europe
A28: 2014 | B28: Slovakia (SVK) | C28: 1 | D28: 0 | E28: 0 | F28: =SUM(RC[-3]:RC[-1]) -> 1 | G28: 63 | H28: 9 | I28: =RC[-3]/RC[-2] -> 1.5873015873015872E-2 | J28: 5415949 | K28: north | L28: 49035 | M28: Europe
B30: General Stats
B31: Nations Participating | C31: 88
B32: Athletes Participating | C32: 2873
B33: Events | C33: 98
B34: Sports | C34: 15

Sheet: Pivot Data Analysis
A1: Data Analysis
A2: Nation | B2: Total Medals | C2: # of Athletes
A3: Russia (RUS) | B3: 33 | C3: 232
A4: United States (USA) | B4: 28 | C4: 230
A5: Norway (NOR) | B5: 26 | C5: 134
A6: Canada (CAN) | B6: 25 | C6: 222
A7: Netherlands (NED) | B7: 24 | C7: 41
A8: Germany (GER) | B8: 19 | C8: 153
A9: Austria (AUT) | B9: 17 | C9: 132
A10: France (FRA) | B10: 15 | C10: 116
A11: Sweden (SWE) | B11: 15 | C11: 106
A12: Switzerland (CHE) | B12: 11 | C12: 163
A13: China (CHN) | B13: 9 | C13: 66
A14: Czech Republic (CZE) | B14: 8 | C14: 88
A15: Slovenia (SLO) | B15: 8 | C15: 66
A16: Italy (ITA) | B16: 8 | C16: 113
A17: South Korea (KOR) | B17: 8 | C17: 71
A18: Japan (JPN) | B18: 8 | C18: 136
A19: Belarus (BLR) | B19: 6 | C19: 26
A20: Poland (POL) | B20: 6 | C20: 59
A21: Finland (FIN) | B21: 5 | C21: 103
A22: Great Britain (GBR) | B22: 4 | C22: 56
A23: Latvia LVA) | B23: 4 | C23: 58
A24: Australia (AUS) | B24: 3 | C24: 60
A25: Ukraine (UKR) | B25: 2 | C25: 45
A26: Croatia (HRV) | B26: 1 | C26: 11
A27: Kazakhstan (KAZ) | B27: 1 | C27: 52
A28: Slovakia (SVK) | B28: 1 | C28: 63
A29: TOTAL | B29: =SUBTOTAL(109,R[-26]C:R[-1]C) -> 295 | C29: =SUBTOTAL(109,R[-26]C:R[-1]C) -> 2602